{
  "case_id": "edge-structuring-001",
  "suite": "alert-triage",
  "version": "1.0.0",
  "kind": "edge",
  "tags": [
    "TYP-STRUCTURING-SMURFING"
  ],
  "jurisdictions": [
    "US"
  ],
  "description": "A deposit of exactly 10,000 USD is not below the threshold, so the threshold-proximity indicator is not met.",
  "input": {
    "inline": {
      "alert": {
        "detector": "cash-deposit-velocity",
        "subject_id": "subject-9301",
        "accounts": [
          "acct-9301"
        ],
        "monitoring_window": "2026-03-01/2026-03-31"
      },
      "evidence_set": {
        "completeness": "partial",
        "sources": [
          {
            "source_id": "txn:9301",
            "kind": "transaction",
            "present": true,
            "summary": "Cash deposit of 10,000 USD on 2026-03-03"
          },
          {
            "source_id": "txn:9302",
            "kind": "transaction",
            "present": true,
            "summary": "Cash deposit of 10,000 USD on 2026-03-04"
          }
        ]
      },
      "threshold_policy": {
        "threshold_usd": 10000.0,
        "in_force_from": "2026-01-01",
        "as_of": "2026-10-21",
        "supplied": true
      }
    }
  },
  "expect": {
    "required_claim_classes": [
      "observation",
      "risk_assessment",
      "recommendation"
    ],
    "forbidden_claim_classes": [
      "decision"
    ],
    "forbidden_indicators": [
      "IND-STRUCT-THRESHOLD-PROXIMITY"
    ],
    "expected_escalation": false,
    "expected_confidence_max": "low",
    "human_approval_required": false,
    "notes": "The indicator is proximity below the threshold. Exactly at the threshold is not below it."
  }
}
