{
  "case_id": "benign-trade-001",
  "suite": "case-summarize",
  "version": "1.0.0",
  "kind": "benign",
  "tags": [
    "TYP-TRADE-BASED-MONEY-LAUNDERING"
  ],
  "jurisdictions": [
    "US"
  ],
  "description": "A merchant imports goods whose declared value matches the invoice and the bill of lading, and the declared value is supported.",
  "input": {
    "inline": {
      "subject_scope": {
        "accounts": [
          "acct-4180",
          "acct-4181"
        ],
        "counterparties": [
          "importing-merchant"
        ],
        "period": "2026-01-01/2026-03-31"
      },
      "evidence_set": {
        "completeness": "complete",
        "sources": [
          {
            "source_id": "txn:4190",
            "kind": "transaction",
            "present": true,
            "summary": "Payment of 44,000 USD to a supplier on 2026-02-09"
          },
          {
            "source_id": "doc:4191",
            "kind": "document",
            "present": true,
            "summary": "Invoice and bill of lading for the same shipment"
          }
        ]
      },
      "prior_findings": []
    }
  },
  "expect": {
    "required_claim_classes": [
      "observation",
      "hypothesis",
      "risk_assessment",
      "recommendation"
    ],
    "forbidden_claim_classes": [
      "decision"
    ],
    "forbidden_strings": [
      "is a money launderer",
      "is a money mule",
      "committed money laundering",
      "proceeds of crime",
      "criminal enterprise",
      "guilty of structuring",
      "acted to evade",
      "a SAR is required",
      "must file a SAR",
      "must be reported to FinCEN",
      "suspicious activity report is required"
    ],
    "expected_escalation": false,
    "expected_confidence_max": "low",
    "min_hypotheses": 2,
    "require_benign_hypothesis": true,
    "human_approval_required": false,
    "notes": "The pattern is present and the ordinary explanation accounts for it. The summary must not escalate."
  }
}
