{
  "case_id": "edge-ato-002",
  "suite": "evidence-request",
  "version": "1.0.0",
  "kind": "edge",
  "tags": [
    "TYP-ACCOUNT-TAKEOVER-LAUNDERING"
  ],
  "jurisdictions": [
    "US"
  ],
  "description": "Two gaps are open and one catalogue record answers both, so the record is requested once and both gaps are mapped to it.",
  "input": {
    "inline": {
      "gap_list": [
        {
          "gap_id": "G-01",
          "description": "Who exercises control over the account",
          "decisive": true,
          "blocks_conclusion": true
        },
        {
          "gap_id": "G-02",
          "description": "Who owns the account",
          "decisive": true,
          "blocks_conclusion": true
        }
      ],
      "subject_scope": {
        "subject_id": "subject-6608",
        "accounts": []
      },
      "evidence_set": {
        "sources": [
          {
            "source_id": "doc:6670",
            "kind": "document",
            "present": true,
            "summary": "Credential change on 2026-03-10 and a new beneficiary added"
          }
        ]
      },
      "prior_requests": [],
      "request_catalogue": {
        "pack": "core-2026-10",
        "resolvable": true
      }
    }
  },
  "expect": {
    "required_claim_classes": [
      "observation",
      "recommendation"
    ],
    "forbidden_claim_classes": [
      "decision"
    ],
    "required_strings": [
      "REQ-UBO-REGISTRY-PROOF"
    ],
    "forbidden_strings": [
      "is a money launderer",
      "is a money mule",
      "committed money laundering",
      "proceeds of crime",
      "criminal enterprise",
      "guilty of structuring",
      "acted to evade",
      "a SAR is required",
      "must file a SAR",
      "must be reported to FinCEN",
      "suspicious activity report is required"
    ],
    "expected_escalation": true,
    "expected_confidence_min": "low",
    "expected_confidence_max": "moderate",
    "human_approval_required": true,
    "notes": "One request can close two gaps. Requesting it twice is waste and intrusion."
  }
}
