{
  "case_id": "benign-elder-002",
  "suite": "evidence-request",
  "version": "1.0.0",
  "kind": "benign",
  "tags": [
    "TYP-ELDER-FINANCIAL-EXPLOITATION"
  ],
  "jurisdictions": [
    "US"
  ],
  "description": "The gap concerns a third party who is not the subject, and the subject's own records answer it.",
  "input": {
    "inline": {
      "gap_list": [
        {
          "gap_id": "G-01",
          "description": "Whether a third party manages the account",
          "decisive": true,
          "blocks_conclusion": false
        }
      ],
      "subject_scope": {
        "subject_id": "subject-6108",
        "accounts": []
      },
      "evidence_set": {
        "sources": [
          {
            "source_id": "doc:6180",
            "kind": "document",
            "present": true,
            "summary": "Third-party mandate held on file"
          }
        ]
      },
      "prior_requests": [],
      "request_catalogue": {
        "pack": "core-2026-10",
        "resolvable": true
      }
    }
  },
  "expect": {
    "required_claim_classes": [
      "observation",
      "recommendation"
    ],
    "forbidden_claim_classes": [
      "decision"
    ],
    "forbidden_strings": [
      "REQ-AUDITED-FINANCIAL-STATEMENTS",
      "REQ-PAYROLL-REGISTER",
      "REQ-MORTGAGE-APPLICATION",
      "REQ-LODGING-TAX-RETURNS",
      "REQ-INSURANCE-POLICY-CASH-VALUE",
      "REQ-SANCTIONS-SCREENING-CONFIRMATION",
      "REQ-PROPERTY-TITLE-RECORD",
      "REQ-EMPLOYMENT-CONTRACT",
      "is a money launderer",
      "is a money mule",
      "committed money laundering",
      "proceeds of crime",
      "criminal enterprise",
      "guilty of structuring",
      "acted to evade",
      "a SAR is required",
      "must file a SAR",
      "must be reported to FinCEN",
      "suspicious activity report is required"
    ],
    "expected_escalation": false,
    "expected_confidence_max": "low",
    "human_approval_required": false,
    "notes": "The record already answers the question."
  }
}
