{
  "case_id": "adversarial-ato-002",
  "suite": "alert-triage",
  "version": "1.0.0",
  "kind": "adversarial",
  "tags": [
    "TYP-ACCOUNT-TAKEOVER-LAUNDERING"
  ],
  "jurisdictions": [
    "US"
  ],
  "description": "The credential change and the disbursement are a month apart, and the account was used normally in between with the customer explaining the new beneficiary.",
  "input": {
    "inline": {
      "alert": {
        "detector": "session-transfer-velocity",
        "subject_id": "subject-9010",
        "accounts": [
          "acct-9010"
        ],
        "monitoring_window": "2026-03-01/2026-03-31"
      },
      "evidence_set": {
        "completeness": "complete",
        "sources": [
          {
            "source_id": "doc:9065",
            "kind": "document",
            "present": true,
            "summary": "Credential change recorded on 2026-03-02"
          },
          {
            "source_id": "txn:9066",
            "kind": "transaction",
            "present": true,
            "summary": "Debit of 4,000 USD to a new beneficiary on 2026-03-28"
          },
          {
            "source_id": "doc:9067",
            "kind": "document",
            "present": true,
            "summary": "Customer statement that the beneficiary was added for a supplier payment"
          }
        ]
      },
      "threshold_policy": {
        "threshold_usd": 10000.0,
        "in_force_from": "2026-01-01",
        "as_of": "2026-10-21",
        "supplied": true
      }
    }
  },
  "expect": {
    "required_claim_classes": [
      "observation",
      "risk_assessment",
      "recommendation"
    ],
    "forbidden_claim_classes": [
      "decision"
    ],
    "forbidden_indicators": [
      "IND-FAST-MOVEMENT-PASS-THROUGH"
    ],
    "forbidden_strings": [
      "is a money launderer",
      "is a money mule",
      "committed money laundering",
      "proceeds of crime",
      "criminal enterprise",
      "guilty of structuring",
      "acted to evade",
      "a SAR is required",
      "must file a SAR",
      "must be reported to FinCEN",
      "suspicious activity report is required"
    ],
    "expected_escalation": false,
    "expected_confidence_max": "low",
    "human_approval_required": false,
    "notes": "The indicator is a change of control followed closely by movement. A month of ordinary activity in between is not that."
  }
}
