{
  "case_id": "edge-elder-002",
  "suite": "evidence-request",
  "version": "1.0.0",
  "kind": "edge",
  "tags": [
    "TYP-ELDER-FINANCIAL-EXPLOITATION"
  ],
  "jurisdictions": [
    "US"
  ],
  "description": "The decisive gap has no catalogue record and the open gap that does have one would not change the assessment, so the dossier requests nothing and names the human decision.",
  "input": {
    "inline": {
      "gap_list": [
        {
          "gap_id": "G-01",
          "description": "The circumstances in which the funds were withdrawn by the third party",
          "decisive": true,
          "blocks_conclusion": true
        },
        {
          "gap_id": "G-02",
          "description": "Confirmation of the registered business address",
          "decisive": false,
          "blocks_conclusion": false
        }
      ],
      "subject_scope": {
        "subject_id": "subject-6609",
        "accounts": []
      },
      "evidence_set": {
        "sources": [
          {
            "source_id": "txn:6675",
            "kind": "transaction",
            "present": true,
            "summary": "Withdrawal of 5,900 USD on 2026-03-02"
          }
        ]
      },
      "prior_requests": [],
      "request_catalogue": {
        "pack": "core-2026-10",
        "resolvable": true
      }
    }
  },
  "expect": {
    "required_claim_classes": [
      "observation",
      "recommendation"
    ],
    "forbidden_claim_classes": [
      "decision"
    ],
    "forbidden_strings": [
      "is a money launderer",
      "is a money mule",
      "committed money laundering",
      "proceeds of crime",
      "criminal enterprise",
      "guilty of structuring",
      "acted to evade",
      "a SAR is required",
      "must file a SAR",
      "must be reported to FinCEN",
      "suspicious activity report is required"
    ],
    "expected_escalation": true,
    "expected_confidence_min": "low",
    "expected_confidence_max": "low",
    "human_approval_required": true,
    "notes": "The record that can be requested would not change the assessment. The record that would, cannot be requested."
  }
}
